{"authorization_id":"semantic-ir-provider-schema-capability-probe-002","authorized_at":"2026-08-31T17:14:57-03:00","calibration_launch_authorized":false,"commit_schema_sha256":"a6f6a271f44b634a6b1750d89ba4fbdc0f829ad8d3b2cb0c7ac9d5e49e199f40","execution_freeze_sha256":"40b0d3e2f2041dd6deb70da5db2960afbba609a9f1757032bd684b7261e47c72","explicit_user_authorization":true,"finish_schema_sha256":"6d68e540eb5eb5132c2228cb684876fd1a3c311c94d12f9c6e76262b617e4049","grammar_artifact_lock_sha256":"7b9da576168f6589af6223aa720baaedcfd18f7ff1f818a0ba64619a4dc5de16","maximum_provider_requests":2,"schema_version":"ai-experiments.semantic-ir.provider-schema-capability-probe-authorization/v2","scope":"provider_schema_capability_probe_v2_only"}
